{
  "approvals": {
    "approval_hash": "",
    "approval_id": "",
    "plan_id": ""
  },
  "artifacts": {
    "artifact_manifest": ".ai/artifacts/T-OS-418/20260516T034000Z-T-OS-418-2774c127/artifact_manifest.json",
    "diff_patch": "",
    "handoff": ""
  },
  "attempts": {
    "count": 0,
    "last_attempt_at": null,
    "last_error": null,
    "max": 3
  },
  "commit": {
    "author_email": "orgos-integrator@local",
    "author_name": "OrgOS Integrator",
    "commit_sha": "d7d39c69aca7e685f30c71ab05ec0e27075cffee",
    "integrated_at": "2026-05-16T03:39:29Z",
    "message": "docs(kernel-v2): T-OS-418 Manager dogfood execution log",
    "target_branch": "main",
    "trailers": {
      "OrgOS-Task": "T-OS-418"
    }
  },
  "created_at": "2026-05-16T03:39:28Z",
  "created_by": {
    "id": "request-integration.sh",
    "role": "manager",
    "session_id": ""
  },
  "dependencies": {
    "queue_items": [],
    "tasks": []
  },
  "item_id": "IQ-20260516T033928Z-T-OS-418-594dfb80",
  "priority": 50,
  "project_id": "orgos",
  "retention": {
    "keep_until": "2026-08-14T03:39:28Z"
  },
  "schema_version": "orgos.integration_queue.v1",
  "scope": {
    "allowed_paths": [
      "docs/kernel-v2/"
    ],
    "diff_budget": {
      "max_files": 10,
      "max_lines": 5000
    },
    "prohibited_paths": []
  },
  "status": "done",
  "task_id": "T-OS-418",
  "verification": {
    "artifacts": [],
    "commands": [],
    "passed_at": "2026-05-16T03:39:28Z",
    "required": true,
    "status": "passed"
  },
  "worktree": {
    "base_branch": "main",
    "base_commit": "32e516f775137a00bfa1586a9e4829edeeeb5a37",
    "branch": "task/T-OS-418-dogfood",
    "expected_head": "32e516f775137a00bfa1586a9e4829edeeeb5a37",
    "path": "/Users/youyokotani/Dev/Private/OrgOS"
  }
}
