{
  "approvals": {
    "approval_hash": "",
    "approval_id": "",
    "plan_id": ""
  },
  "artifacts": {
    "artifact_manifest": ".ai/artifacts/T-OS-428/20260516T050000Z-T-OS-428-6d6fc750/artifact_manifest.json",
    "diff_patch": "",
    "handoff": ""
  },
  "attempts": {
    "count": 0,
    "last_attempt_at": null,
    "last_error": null,
    "max": 3
  },
  "commit": {
    "author_email": "orgos-integrator@local",
    "author_name": "OrgOS Integrator",
    "commit_sha": "80029d5331ed978c7580134e5c06565473c88223",
    "integrated_at": "2026-05-16T04:40:11Z",
    "message": "docs(kernel-v2): hardening digest + finalize 11 task statuses (T-OS-428)",
    "target_branch": "main",
    "trailers": {
      "OrgOS-Task": "T-OS-428"
    }
  },
  "created_at": "2026-05-16T04:40:07Z",
  "created_by": {
    "id": "request-integration.sh",
    "role": "manager",
    "session_id": ""
  },
  "dependencies": {
    "queue_items": [],
    "tasks": []
  },
  "item_id": "IQ-20260516T044007Z-T-OS-428-24835770",
  "priority": 50,
  "project_id": "orgos",
  "retention": {
    "keep_until": "2026-08-14T04:40:07Z"
  },
  "schema_version": "orgos.integration_queue.v1",
  "scope": {
    "allowed_paths": [
      ".ai/REVIEW/T-OS-400/HARDEN_DIGEST.md",
      ".ai/TASKS.yaml"
    ],
    "diff_budget": {
      "max_files": 10,
      "max_lines": 5000
    },
    "prohibited_paths": []
  },
  "status": "done",
  "task_id": "T-OS-428",
  "verification": {
    "artifacts": [],
    "commands": [],
    "passed_at": "2026-05-16T04:40:07Z",
    "required": true,
    "status": "passed"
  },
  "worktree": {
    "base_branch": "main",
    "base_commit": "ff34dc87e899d5c34b6687a06c0458c7c8b0a2c1",
    "branch": "task/T-OS-428-final",
    "expected_head": "ff34dc87e899d5c34b6687a06c0458c7c8b0a2c1",
    "path": "/Users/youyokotani/Dev/Private/OrgOS"
  }
}
