{
  "approvals": {
    "approval_hash": "",
    "approval_id": "",
    "plan_id": ""
  },
  "artifacts": {
    "artifact_manifest": ".ai/artifacts/T-OS-429/20260516T060000Z-T-OS-429-6918636e/artifact_manifest.json",
    "diff_patch": "",
    "handoff": ""
  },
  "attempts": {
    "count": 0,
    "last_attempt_at": null,
    "last_error": null,
    "max": 3
  },
  "commit": {
    "author_email": "orgos-integrator@local",
    "author_name": "OrgOS Integrator",
    "commit_sha": "745ed2b29d8b6a43e30b8f2e1c4c27b1148d0295",
    "integrated_at": "2026-05-16T07:42:26Z",
    "message": "docs(meta): prepare 6th-round GPT-5.5 Pro post-hardening validation prompt (T-OS-429)",
    "target_branch": "main",
    "trailers": {
      "OrgOS-Task": "T-OS-429"
    }
  },
  "created_at": "2026-05-16T07:42:20Z",
  "created_by": {
    "id": "request-integration.sh",
    "role": "manager",
    "session_id": ""
  },
  "dependencies": {
    "queue_items": [],
    "tasks": []
  },
  "item_id": "IQ-20260516T074220Z-T-OS-429-96c6f8d4",
  "priority": 50,
  "project_id": "orgos",
  "retention": {
    "keep_until": "2026-08-14T07:42:20Z"
  },
  "schema_version": "orgos.integration_queue.v1",
  "scope": {
    "allowed_paths": [
      ".ai/REVIEW/T-OS-400/external-ai-6th-prompt.md",
      ".ai/TASKS.yaml"
    ],
    "diff_budget": {
      "max_files": 10,
      "max_lines": 5000
    },
    "prohibited_paths": []
  },
  "status": "done",
  "task_id": "T-OS-429",
  "verification": {
    "artifacts": [],
    "commands": [],
    "passed_at": "2026-05-16T07:42:20Z",
    "required": true,
    "status": "passed"
  },
  "worktree": {
    "base_branch": "main",
    "base_commit": "80029d5331ed978c7580134e5c06565473c88223",
    "branch": "task/T-OS-429-6th-prompt",
    "expected_head": "80029d5331ed978c7580134e5c06565473c88223",
    "path": "/Users/youyokotani/Dev/Private/OrgOS"
  }
}
