{
  "approvals": {
    "approval_hash": "",
    "approval_id": "",
    "plan_id": ""
  },
  "artifacts": {
    "artifact_manifest": ".ai/artifacts/T-OS-427/20260516T044000Z-T-OS-427-0550779b/artifact_manifest.json",
    "diff_patch": "",
    "handoff": ""
  },
  "attempts": {
    "count": 0,
    "last_attempt_at": null,
    "last_error": null,
    "max": 3
  },
  "commit": {
    "author_email": "orgos-integrator@local",
    "author_name": "OrgOS Integrator",
    "commit_sha": "ff34dc87e899d5c34b6687a06c0458c7c8b0a2c1",
    "integrated_at": "2026-05-16T03:53:17Z",
    "message": "config(kernel-v2): enforce IntegratorOnlyCommit/ProtectedBranchNoTouch/DurableArtifact/StateMutation (T-OS-427)",
    "target_branch": "main",
    "trailers": {
      "OrgOS-Task": "T-OS-427"
    }
  },
  "created_at": "2026-05-16T03:53:15Z",
  "created_by": {
    "id": "request-integration.sh",
    "role": "manager",
    "session_id": ""
  },
  "dependencies": {
    "queue_items": [],
    "tasks": []
  },
  "item_id": "IQ-20260516T035315Z-T-OS-427-16c8ea0d",
  "priority": 50,
  "project_id": "orgos",
  "retention": {
    "keep_until": "2026-08-14T03:53:15Z"
  },
  "schema_version": "orgos.integration_queue.v1",
  "scope": {
    "allowed_paths": [
      ".claude/state/kernel-mode.json"
    ],
    "diff_budget": {
      "max_files": 10,
      "max_lines": 5000
    },
    "prohibited_paths": []
  },
  "status": "done",
  "task_id": "T-OS-427",
  "verification": {
    "artifacts": [],
    "commands": [],
    "passed_at": "2026-05-16T03:53:15Z",
    "required": true,
    "status": "passed"
  },
  "worktree": {
    "base_branch": "main",
    "base_commit": "a7519455512d0684bee1b9f62980f03bfbbd2d57",
    "branch": "task/T-OS-427-kernel-mode-enforce",
    "expected_head": "a7519455512d0684bee1b9f62980f03bfbbd2d57",
    "path": "/Users/youyokotani/Dev/Private/OrgOS"
  }
}
